id,texto,contexto,advocacy,atack,image,issue,call to action,ceremonial,comentarios
1283395299494011,"PAIS 52 ROCHA Somos un grupo de trabajadores que busca posicionarse para sumar en ideas, propuestas Llamar",,1,0,1,0,1,0,
1284164229252349,"""EN FLORIDA PEDI TU LISTA AL\n091 924 508"" La lista 25 es mi lista, es la lista de mi grupo, es la lista que va a tener el único Senado que yo voy a encabezar. Y esto quiero ser bien claro, no sin demérito de nadie, pero quiero decirlo que...",,0,0,0,0,1,0,
1284193272475328,"""Vamos a combatir el delito con firmeza en la represión y actuando desde la prevención, hay que actuar antes de que el delito ocurra #LaFormulaParaGanar #Ojeda600 #Patidocolorado #Renovación"" Yo no tengo duda que la Guardia Republicana tiene que ir y tener permanencia en los lugares conflictivos llamadas zonas rojas o como lo queramos denominar, y permanencia y perseguir el delito. Pero también creo que nosotros tenemos situaciones de calle que a todos nos golpean, por eso creemos en la internación compulsiva que el Frente Amplio no, nosotros sí, por eso proponemos crear centros de rescate y rehabilitación de las drogas, porque hay gente que está vinculado también a salud mental, hay mucha gente en la calle que son liberados, que cumplen sus penas, salen a la calle, no tienen trabajo, no tienen educación, no tienen oficio, tienen problemas de droga, entonces de consumo, vuelven al círculo. Claro, 70% reincide, entonces hay que hacer algo, y por eso yo creo que nos complementamos bien en una propuesta integral de seguridad donde Diego Sanjurjo, formado la persona que sabe y sabe de seguridad a nuestro criterio, que nos ha apoyado siempre y nos ha respaldado en todo este tema, y subía con su función en la Fiscalía General de la Nación junto con otros integrantes del equipo.",,1,1,0,1,0,0,
1285145446229205,"Este 30 de junio iniciamos un nuevo camino y queremos que renueves tu confianza...porque queda mucho por hacer. #VamosConTodo #ManiniPresidente Cabildo Abierto Este 30 de junio iniciamos un nuevo camino y queremos que renueves tu confianza porque queda mucho por hacer, porque vamos a ser firmes contra la delincuencia y el narcotráfico, porque el trabajo nacional es nuestra prioridad, porque no queremos que desde afuera nos marquen el camino, porque no vamos a parar hasta que la familia vuelva a ser la base de nuestra sociedad, evitando que ideologías y normas continúen destruyendo la. Continuamos como desde el principio, siempre en defensa de los de a pie. Acompañanos, el Uruguay de nuestros hijos está en marcha. Vamos con todo, Manini Presidente.",,1,0,0,1,1,0,
1285617135932809,"""Andrés Ojeda El Nuevo Presidente. Nueva Sociedad. Votalo en la 9007."" La sociedad cambió y la familia cambió. Hoy tenemos nuevos modelos de familia, hoy tenemos familias multi especie. A nuestros padres, nuestros hijos y abuelos hoy se suman nuestras mascotas. Ellas son parte de nuestro hogar. A estos nuevos miembros los vamos a proteger y a cuidar como a todos los que integran nuestra familia.",,1,0,0,1,1,0,
1288005378868186,"""Hay que cerrar el Instituto Nacional de Colonización y destinar las más de 400 hectáreas a la Educación y Vivienda."" Hay que cerrar el Instituto Nacional de Colonización y vender las casi 400.000 hectáreas, destinándolas a través de un fideicomiso para la educación y la vivienda. Hay que pensar en el Uruguay de los próximos 30 años. Tenemos que avanzar.",,1,0,0,1,0,0,
1292098181827876,"""El Director Nacional de Trabajo, Federico Daverede, es parte de la lista 404. Con su trabajo demostró que este equipo está hecho para gobernar, reelegí un buen gobierno.\n\nEl 27 de octubre votá la lista 404, el CORAZÓN del gobierno.\n\n#404 #ElCorazonDelGobierno"" En este gobierno, cuando empezamos a los 10 días, nos cayó la pandemia. El tema laboral, la verdad que en el mundo se destruyeron más de 400 millones de puestos de trabajo horario completo, solo para septiembre de 2020. Y por suerte Uruguay, que habíamos recibido un país con el 10,5% de desempleo, pudo sobrellevar bastante bien esa situación gracias a muchas de las medidas que implementó el gobierno. Y eso provocó que muchos trabajadores, sin perjuicio de la complejidad que estaban pasando las empresas, no perdieran su relación con el mundo laboral. Y eso habla de la gran gestión que se hizo, no solo en el mercado de trabajo, sino en materia política económica en general. Muchos incentivos a las empresas para que se estallen y también nos trajo, por supuesto, una creación de más de 100,000 puestos de trabajo. El 27 de octubre, votar a lista 404, el corazón del gobierno.",,1,0,1,1,0,0,
1297021371324616,{} Los integrantes de la lista 40 proponemos una campaña con propuestas reales y posibles. Por eso apoyamos a Mario Ayala y a Álvaro Delgado.,,1,0,0,1,0,0,
1297161624964921,"""Este 27 de octubre votá la Lista 22. La Lista de Valeria Ripoll en Montevideo. Pedila al 092 220 222"" No es lo mismo renovación y alegría que anclarse en el pasado. No es lo mismo. Vótalo a 22. Mi lista en Montevideo.",,0,0,0,0,1,0,
1297186251443498,"[""Este domingo Votá la Lista 404.\nEl corazón del gobierno."",""Este domingo Votá la Lista 404.\nEl corazón del gobierno.""] Este domingo 27 de octubre apoyá al gobierno de Luis. Votáela 404. Vamos por la reelección de un gran gobierno para seguir construyendo el mejor país del mundo. El nuestro. Gobernar es con el corazón.",,1,0,0,0,1,0,
1302782621122444,"Próximo viernes 17, a las 18 hs vamos con ella, con #Carolina #CanelonesConCarolina #MujeresConCarolina. https://www.facebook.com/profile.php?id=100089538735861&mibextid=ZbWKwL",,0,0,0,0,1,1,
1302934997367046,"['Hola, soy Javier Barrios, Edil por el Partido Nacional 🇺🇾 A lo largo de mi trayectoria, trabaje para atender las necesidades de cada vecino y vecina, convencido de que el cambio comienza en lo cotidiano y que juntos podemos forjar una visión compartida para el futuro de Montevideo 💪\n\nCada esfuerzo cuenta cuando se trata de mejorar los espacios que habitamos, esos espacios de pertenecia donde nuestros hijos crecen y nuestros nietos juegan. 💙 Este trabajo va más allá de lo individual; es el resultado de un compromiso comunitario que busca construir una ciudad más segura y acogedora. \n\nImaginemos juntos un municipio que recorre sus calles, habita sus plazas, pasea por la rambla y charla en la vereda. Al final del día, somos nosotros, los vecinos, quienes damos vida a nuestros barrios y a Montevideo. ✨️ Sigamos trabajando unidos para hacer de nuestra ciudad un lugar donde todos puedan soñar, crecer y ser felices. \n\n#montevideo #barrio #comunidad #PorMiBarrio', 'Hola, soy Javier Barrios, Edil por el Partido Nacional 🇺🇾 A lo largo de mi trayectoria, trabaje para atender las necesidades de cada vecino y vecina, convencido de que el cambio comienza en lo cotidiano y que juntos podemos forjar una visión compartida para el futuro de Montevideo 💪\n\nCada esfuerzo cuenta cuando se trata de mejorar los espacios que habitamos, esos espacios de pertenecia donde nuestros hijos crecen y nuestros nietos juegan. 💙 Este trabajo va más allá de lo individual; es el resultado de un compromiso comunitario que busca construir una ciudad más segura y acogedora. \n\nImaginemos juntos un municipio que recorre sus calles, habita sus plazas, pasea por la rambla y charla en la vereda. Al final del día, somos nosotros, los vecinos, quienes damos vida a nuestros barrios y a Montevideo. ✨️ Sigamos trabajando unidos para hacer de nuestra ciudad un lugar donde todos puedan soñar, crecer y ser felices. \n\n#montevideo #barrio #comunidad #PorMiBarrio', 'Hola, soy Javier Barrios, Edil por el Partido Nacional 🇺🇾 A lo largo de mi trayectoria, trabaje para atender las necesidades de cada vecino y vecina, convencido de que el cambio comienza en lo cotidiano y que juntos podemos forjar una visión compartida para el futuro de Montevideo 💪\n\nCada esfuerzo cuenta cuando se trata de mejorar los espacios que habitamos, esos espacios de pertenecia donde nuestros hijos crecen y nuestros nietos juegan. 💙 Este trabajo va más allá de lo individual; es el resultado de un compromiso comunitario que busca construir una ciudad más segura y acogedora. \n\nImaginemos juntos un municipio que recorre sus calles, habita sus plazas, pasea por la rambla y charla en la vereda. Al final del día, somos nosotros, los vecinos, quienes damos vida a nuestros barrios y a Montevideo. ✨️ Sigamos trabajando unidos para hacer de nuestra ciudad un lugar donde todos puedan soñar, crecer y ser felices. \n\n#montevideo #barrio #comunidad #PorMiBarrio', 'Hola, soy Javier Barrios, Edil por el Partido Nacional 🇺🇾 A lo largo de mi trayectoria, trabaje para atender las necesidades de cada vecino y vecina, convencido de que el cambio comienza en lo cotidiano y que juntos podemos forjar una visión compartida para el futuro de Montevideo 💪\n\nCada esfuerzo cuenta cuando se trata de mejorar los espacios que habitamos, esos espacios de pertenecia donde nuestros hijos crecen y nuestros nietos juegan. 💙 Este trabajo va más allá de lo individual; es el resultado de un compromiso comunitario que busca construir una ciudad más segura y acogedora. \n\nImaginemos juntos un municipio que recorre sus calles, habita sus plazas, pasea por la rambla y charla en la vereda. Al final del día, somos nosotros, los vecinos, quienes damos vida a nuestros barrios y a Montevideo. ✨️ Sigamos trabajando unidos para hacer de nuestra ciudad un lugar donde todos puedan soñar, crecer y ser felices. \n\n#montevideo #barrio #comunidad #PorMiBarrio', 'Hola, soy Javier Barrios, Edil por el Partido Nacional 🇺🇾 A lo largo de mi trayectoria, trabaje para atender las necesidades de cada vecino y vecina, convencido de que el cambio comienza en lo cotidiano y que juntos podemos forjar una visión compartida para el futuro de Montevideo 💪\n\nCada esfuerzo cuenta cuando se trata de mejorar los espacios que habitamos, esos espacios de pertenecia donde nuestros hijos crecen y nuestros nietos juegan. 💙 Este trabajo va más allá de lo individual; es el resultado de un compromiso comunitario que busca construir una ciudad más segura y acogedora. \n\nImaginemos juntos un municipio que recorre sus calles, habita sus plazas, pasea por la rambla y charla en la vereda. Al final del día, somos nosotros, los vecinos, quienes damos vida a nuestros barrios y a Montevideo. ✨️ Sigamos trabajando unidos para hacer de nuestra ciudad un lugar donde todos puedan soñar, crecer y ser felices. \n\n#montevideo #barrio #comunidad #PorMiBarrio'] Hola, soy Javier Barrios-Bove, el líder del Partido Nacional. Quizás me reconozcas por haber confrontado y denunciado las pésimas gestiones del Frente Amplio en Montevideo. Tengo 47 años, soy abogado, esposo y orgulloso padre de Agus y Nacho. Hace más de 20 años que vivo en Positos. Mi sueño es tener un Montevideo diferente. Los grandes cambios empiezan con las cosas cotidianas de todos los días. Mejorando a nuestro barrio, vamos a tener una ciudad más disfrutable. Juntos podemos lograr un lugar en donde estemos orgullosos de vivir.",,1,0,1,0,0,0,
1305640347089513,"""📍En Piriápolis gestionamos equipamiento para la Plaza de barrio La Lechuga.📍 En Solis se está llevando a cabo la construcción de deck y pasarela en el Paso Real.📍 En Maldorado la cimentación del Centro Departamental de Atención a la Mujer.📍En Algua la sala de desintoxicación de adicciones."" Rodrigo Blas, gestión parlamentaria 2020-2025. 7. Acordó con la oficina de planeamiento y presupuesto OPP fondos para ejecutar obras en cuatro municipios de Maldonado. En Priápolis, equipamiento para la plaza del barrio La Lechuga. En Solís, construcción de deck y pasarela en El Paso Real. En Maldonado, cimentación del Centro Departamental de Atención a la Mujer. Y en Aiguá, la sala de desintoxicación de adicciones. Estas obras están en proceso de ejecución. Por Maldonado, Rodrigo siempre estuvo. Hoy más que nunca. Rodrigo tiene que estar. Delgado es 23. Rodrigo es 23.",,1,0,0,1,0,0,
1305640447088408,"[""La Lista 10 es el camino para un Uruguay que cuide mejor a nuestras mascotas. Ojeda Presidente, Bordaberry Senador, y vos votando por protección animal real. 🐕🐾\n\n🔟 Ellos también importan.\n\n#OjedaPresidente #FamiliaMultiespecie #Lista10\n#OjedaPresidente #BordaerrySenador #VerriDiputado #VamosPaysandú #VamosUruguay #Verri10 #La10"",""La Lista 10 es el camino para un Uruguay que cuide mejor a nuestras mascotas. Ojeda Presidente, Bordaberry Senador, y vos votando por protección animal real. 🐕🐾\n\n🔟 Ellos también importan.\n\n#OjedaPresidente #FamiliaMultiespecie #Lista10\n#OjedaPresidente #BordaerrySenador #VerriDiputado #VamosPaysandú #VamosUruguay #Verri10 #La10"",""La Lista 10 es el camino para un Uruguay que cuide mejor a nuestras mascotas. Ojeda Presidente, Bordaberry Senador, y vos votando por protección animal real. 🐕🐾\n\n🔟 Ellos también importan.\n\n#OjedaPresidente #FamiliaMultiespecie #Lista10\n#OjedaPresidente #BordaerrySenador #VerriDiputado #VamosPaysandú #VamosUruguay #Verri10 #La10""] Hoy tenemos nuevos modelos de familia. Hoy tenemos familias multi-especie. A nuestros padres, nuestros hijos y abuelos hoy se suman nuestras mascotas. Ellos son parte de nuestro hogar. A estos nuevos miembros los vamos a proteger y a cuidar como a todos los que integran nuestra familia.",,1,0,0,1,1,0,
1316887699690446,"""Sumate a la campaña. Dejanos tus datos.""",,0,0,0,0,1,0,
1318848139098604,"""Conozco bien lo que necesitan los jóvenes del Uruguay. El domingo 27, votá 880."" Conozco bien lo que necesitan los jóvenes del Uruguay. Quiero seguir siendo tu voz en el parlamento y luchando por vos y por quienes quieren hacer crecer a este país. Este domingo acompañame con tu voto. Cuento contigo.",,1,0,1,0,1,0,
1319666385657749,"Este 30 de junio votá a Álvaro Delgado Presidente con la lista 40423, Rodrigo Blás Intendente y la 4423 con Pablo Chalar Diputado. #SigamosCambiando, Este 30 de junio votá a Álvaro Delgado Presidente con la lista 40423, Rodrigo Blás Intendente y la 4423 con Pablo Chalar Diputado. #SigamosCambiando vemos en puentes, en carreteras, bien decía, en obras de infraestructura vial que lo que hacen es permitir a aquellos que están más lejos de las tomas de decisión estar un poco más cerca, porque si algo este gobierno hizo, se comprometió y lo hizo en obras y en hechos concretos fue llevar el Estado a aquellos uruguayos que están más lejos y distantes de los centros de tomas de decisión. Eso es democratizar, eso es libertad, eso es descentralización, eso es acordarse que el ciudadano del interior, todos nosotros, no somos de segunda categoría.",,1,0,0,1,1,0,
1327044421598830,"""Quiero seguir trabajando para poder avanzar en los temas que le importan a las personas.\n\nNuestro trabajo requiere del intercambio permanente y tener una visión moderna de cara al futuro.\n\nJuntos, vayamos por 5 años más de avances, sigamos innovando en los temas importantes."" Sabía que Pedro está en el Partido Nacional, Pedro Gizdonián impulsó un proyecto para mejorar el acceso a más y mejores derechos para los trabajadores sexuales. Sabemos lo vulnerables que son y las dificultades que tienen para desarrollar su trabajo y por eso después de casi 20 años de que no existía una normativa, conformamos un equipo y le dimos respuesta para en definitiva dignificar a todas estas personas que hoy en día están haciendo esta actividad. Además, le dio voz a quienes no la tienen, los animales. Redactamos un proyecto de ley que va destinado a terminar con la crueldad animal y en definitiva que los que realizan y cometen actos de maltrato tengan las penas que se me dé.",,1,0,1,1,0,0,
1328762348111389,"['""Para mi es una enorme satisfacción que quede alguien de mi barra"" #YamandúOrsiPresidente #SabremosCummplir'] y cuando uno se está por ir, piensa quién queda y para mí es una enorme satisfacción que quede alguien de mi barra.",,1,0,1,0,0,0,
1333073317592791,Necesitamos personas como vos para marcar la diferencia en las elecciones internas. Sumate a IMPACTO para ser parte del cambio que queremos ver en Uruguay. Registrate en nuestra página web: gurmendez.uy ↗️ #GurméndezPresidente #VaEnSerio ¿Te gustaría formar parte de algo especial en las elecciones internas del próximo 30 de junio? Para marcar la diferencia necesitamos personas como vos que se sumen. Unite a nosotros y sé parte del cambio que queremos ver en este país. Juntos podemos dejar una huella. Soy Gabriel Gourmendes. Sumate a Impacto registrándote en nuestra página web.,,0,0,0,0,1,0,
1340327954028807,"La nueva politica es la que genera consensos, no la que divide. ¿Cuál es la vieja política? La vieja política es la que destruye, es la que se enfrenta, es la de los políticos peleando, es la del populismo. Yo no quiero hablar de la vieja, quiero hablar de la nueva. La nueva política es la que propone, es la que genera consenso, es la que se remanga igual territorio, es la que está cerca de la gente. Entonces bueno, se trata de encontrar un camino del medio de cómo hacemos para que todos comprometernos en que 33 crezca y avance, esos son los consensos. No es solo mi visión, que tengo que concluir con la visión de otra gente. Eso es como hago que la visión de todos confluya en sus visiones para decir. Eso es generar consenso.",,1,0,1,0,0,0,
1355599635108296,"Presentamos nuestro programa de gobierno: “Un Uruguay que Va en Serio”. Nuestras ideas desarrolladas por más de 200 técnicos, para construir un país enfocado al crecimiento. ↗️ Nada de esto será posible sin seriedad y sin la confianza moral. Dos pilares que nos permitirán conectar con el Uruguay del futuro, un Uruguay sin límites y en libertad. 🇺🇾 Vamos por el Uruguay del futuro. Vamos en serio. #GurméndezPresidente Este es mi programa de gobierno, un Uruguay que va en serio. Con estas ideas vamos a construir entre todos un país mejor de oportunidades y de crecimiento. Lo estamos haciendo con este equipo formidable, un equipo que sabe hacer, que tiene visión de futuro, que tiene experiencia y que tiene conocimiento. También les ofrecemos transparencia, la transparencia de los que actuamos en la vida con los mismos valores en lo político y en lo privado. Que no tenemos nada para ocultar ni nada para destruir si los uruguayos nos piden que arringamos cuenta de nuestras cosas. Ambas cosas, la seriedad y la confianza moral son las que nos van a permitir conectarnos con el Uruguay del futuro. ¿Vosotros sabéis por qué? ¡Vosotros sabéis por qué!",,1,0,0,1,0,0,
1356305891748216,"La Semana de la Cerveza nos regaló momentos únicos, para conectar con los sanduceros y con este equipo que día a día lo da todo y un poco más. Esto me encanta que le levanta la oreja así, mira. Está buenísimo, lo suficientemente todo. Me encanta así, bueno, sí, claro. Acá estamos acompañando a todos los anduceros junto a la diputada Nancy Núñez, que también se incorpora al Teograma Movimiento Sumar. Estamos muy entusiasmados porque venimos creciendo mucho. Estamos con una respuesta muy grande de la gente en cada localidad a la que vamos. Ah, no, no, esto es impresionante, ¿o no? Es impresionante. Acá te hace una foto. Yo quiero que te la toque. Gracias. A mí no. Me va a llamar a mi hijo que quiere hacer... Mamá, soy un tipo completo. Imagínate cuando vos naciste en Espinic. Una mujer se pudiera postular presidenta, era imposible, ¿verdad? En 1920. Este tipo de paradas y de recorridas, además de conectarnos con los pobladores y con los que van a visitar, nos permiten también una muy linda conexión y pasar el rato con el equipo, que es un equipo que se está matando, que está dejando todo en la cancha y que bueno disfrutar con ellos también de un gran recital.",,1,0,1,0,0,1,
1383074942385619,"Más derechos. Menos retrocesos. El 30 de junio vamos con Carolina Presidenta. Vamos por ESA!, Más derechos. Menos retrocesos. El 30 de junio vamos con Carolina Presidenta. Vamos por ESA!, Más derechos. Menos retrocesos. El 30 de junio vamos con Carolina Presidenta. Vamos por ESA!, Más derechos. Menos retrocesos. El 30 de junio vamos con Carolina Presidenta. Vamos por ESA!, Más derechos. Menos retrocesos. El 30 de junio vamos con Carolina Presidenta. Vamos por ESA!, Más derechos. Menos retrocesos. El 30 de junio vamos con Carolina Presidenta. Vamos por ESA!, Más derechos. Menos retrocesos. El 30 de junio vamos con Carolina Presidenta. Vamos por ESA!, Más derechos. Menos retrocesos. El 30 de junio vamos con Carolina Presidenta. Vamos por ESA! ¿Está difícil la cosa? Difícil no, está terrible. Encima ahora nos quieren seguir sacando derechos. Y acá los que ganan son los mismos de siempre. A nosotros nos rebajaron los salarios. Achicaron las jubilaciones y nos van a seguir sacando beneficios. Tenés razón, nos impusieron una reforma de la seguridad social. Una reforma de la educación. No hay medicamento. Yo nunca pensé que iba a haber un retroceso tan grande en los derechos como este. Éramos ejemplo en el mundo. Esto no da para más. Acá hay que cambiar la pisada. Volver a serlo. Y hacerlo mejor.",,0,1,0,1,1,0,
1386346402078802,"Vamos a conectar la educación con el mercado laboral para que los jóvenes tengan más oportunidades. Este 30 de junio, te pido tu voto, para que juntos #HagamosHistoria. Vamos a conectar Uruguay con el mundo, vamos a abrir más mercados para generar más empleo. Este 30 de junio te pido tu voto para que juntos hagamos historia. Este 30 de junio tu voto hace historia. Laura Presidenta.",,1,0,0,1,1,0,
1387654848419309,"En Junio la #renovacionavanza 🔴 🛑#AndresOjeda Presidente 🛑Andrés Centurión Diputado - Listas 8 y 825 Señores, yo vine a liderar esta batalla con toda la solvencia del mundo. Tengan claro que la delincuencia le va a pasar muy mal con nosotros. De uso de militares en seguridad interna han fallado. Aquí nuestro cuerpo de choque se llama Guardia Republicana y cuenta con todo esto.",,1,0,0,1,0,0,
