id,texto,contexto,advocacy,atack,image,issue,call to action,ceremonial,comentarios
535207402583683,"""💬 ¿Por qué los jóvenes de Artigas deben irse para poder estudiar?\n\nCon la lista 40, queremos traer de vuelta el UTEC y brindar oportunidades reales para que los jóvenes puedan formarse sin abandonar el departamento. \n\nAdemás, proyectamos la construcción de 500 viviendas y soluciones concretas en salud y trabajo.\n\n🚀 La Lista 40 tiene un plan que beneficiará a toda la comunidad.\n\n👉 https://youtu.be/1fRJImfWSaU\nNo te pierdas la entrevista completa en YouTube y conocé más sobre las propuestas.\n\n ✅Vota lista 40, ✅\nla lista del Cambio y la Renovación para Artigas.\n💪 Vota Álvaro Delgado PRESIDENTE\n\n#Lista40Artigas #FuturoConVocacion #UTECRegresa #500Viviendas #OportunidadesEnArtigas #PropuestasClaras #DelgadoPresidente #JuventudFormada"" Bueno, en cuanto a propuestas hay muchas que está haciendo el sector de Mario Ayala. ¿Qué es lo que necesita la gente en la actividad? Todos los políticos creo que planteamos lo mismo. Salud, trabajo, educación. Tenemos propuestas de salud, tenemos propuestas de trabajo, tenemos las viviendas. Mario tiene el plan de construir 500 viviendas en el quinquenis, se puede hacer. La salud, ya hablamos, tenemos a mi parte, tenemos alfítose ahí también. Tenemos la educación, hay que traer la UTEV de nuevo que se escapó. Y no es verso, hay que traerla, hay que instalarla. Los jóvenes necesitan estudiar acá. Y bueno, se nos quedan acá los jóvenes en Artigas, capaces, con bajos recursos. Y no pueden salir de Artigas y terminan haciendo otra cosa. Terminan haciendo algo por opción y no por vocación.",,1,0,0,1,1,0,
536447302467672,"""Viviana Ubiñas es militante social. Frenteamplista de toda la vida. En Montevideo vota al #Frente_Amplio y la lista 933.\n#YamandúPresidente\n#AndrésLimaSenador"" Hola, soy Bibi y este 27 de octubre te pido que nos preste tu voto. La Nueve 3-3 con Andrés Elví Malsenado.",,1,0,1,0,1,0,
538253718543396,"Este 30 de junio en el cuarto secreto habrá más de 3500 listas, llevá tu 609. #OrsiPresidente #VuelveLaGente",,0,0,0,0,1,0,
539618901988641,"""🚨🚨🚨🚨"" Hoy miles de uruguayos luchan contra su adicción y sus familias viven una realidad angustiante. Debemos actuar ya. Realizaremos una campaña de prevención a través de los medios de comunicación y de todo el sistema educativo. Impulsaremos programas vinculados al fortalecimiento de la familia y a la generación de comunidades sanas. Promoveremos la conquista del tiempo libre con oportunidades para todos los adolescentes y jóvenes. Cambiar las políticas de drogas en Uruguay depende de tu voto. A lo seguro, Manini Presidente.",,1,0,0,1,0,0,
539816848423270,"""Como dice siempre Gustavo,😇con la esperanza de vida en 77 años y este régimen anti pueblo que impuso la Coalición, te quedan apenas 💊12 años de vida, después de jubilarte (si es que llegás). \n\n📉 Encima, te vas a retirar con el 45% de aportes, y no con el 55%, como era antes. \n\n🎸Porque de vivir, de disfrutar, de gozar la vida las y los laburantes, mejor ni hablar, ¿no? \n\n🔨 Lo importante es que seas productivo/a para el mercado todo lo que puedas, si es posible, hasta el ☠️\n\n⚰️ QEPD tu jubilación. \n\n🤔 Mejor pensalo de nuevo y 🗳️votá la 📄papeleta blanca del Sí imaginando tu futuro y el de las demás personas. \n\n🟢 Por la vida, toda la vida, la 90 #VotaSI \n\n#PartidoSocialista\n#Socialistas\n#VotoSí\n#LaReformaDeLaGente\n#Plebiscito\n#SeguridadSocial\n#LaDesigualdadNoNosdaIgual"" La esperanza de vida en Uruguay es de 77 años. Bajo este régimen que te obliga a jubilarte a los 65, te quedarían 12 años para vivir y seguramente no en las mejores condiciones, después de haber trabajado de sol a sol toda tu vida. La reforma que planteó este gobierno de la coalición es absolutamente injusta e insostenible. Vota conciencia, no votés con miedo. Este 27 de octubre votá socialista, votá la 90 y votá sí con la papeleta blanca. Que la desigualdad no te dé igual.",,0,1,0,1,1,0,
539839815641116,"['Son muchos los compatriotas que necesitan de políticas sociales activas que les permitan vivir mejor a ellos y sus familias. Para que nadie quede atrás, para dar ese empujón que nos falta como sociedad para que toda la población pueda vivir dignamente, vamos con Yamandú Presidente.'] Este tiempo nos pide más solidaridad. Hay cientos de familias necesitadas en nuestro Uruguay. Por ello es necesario reforzar el apoyo con las tarjetas Uruguay Social y Bonos de Crianza. Para ello, el 24 de noviembre, vota Yamandú Orsi, presidente.",,1,0,0,1,1,0,
539847128628202,"""Una vez más, como hace años Mujica, ahora Yamandú Orsi preocupado por la mano de obra que hay en el comercio de la droga. ¿Así piensan manejar la seguridad? Durante 15 años no combatieron el microtráfico y nos dejaron un Uruguay con miles de uruguayos dedicados al comercio de la droga. Ahora van otra vez por lo mismo… de no creer. La droga “industria nacional”."" sino es una falsa contradicción yo creo que no es golpear a Cávacas, es golpear a los dos lados porque alguien puede pensar que una noticia que uno se encuentra en un día es un contenedor con x cantidad de toneladas llegó a los puertos de Europa pues algo verlo como algo lejano sin embargo entre esto y esto hay una conexión muy fuerte entre el tubardio, la esquina, la boca de pasta base y eso que pasó hay conexión ¿por qué? porque todo el sistema que se moviliza para el tráfico o para el acopio implica mucha mano de obra a nivel nacional y esa mano de obra son gente joven porque es plata dulce además, mucha plata la que se mueve y ahí previzas de todo, logística, seguridad, o sea es toda una industria",,0,1,0,1,0,0,
541273895298802,"""Lista 10 - La única forma de votar a Pedro en Lavalleja 🚩\n.\n.\n.\n.\n#Pedro #PedroBordaberry #PedroSenador #RobertDiputado #Lista10 #PartidoColorado"" Cuando Dios baja la tierra, baja en minas y en abril. Y cuando quieras botar a Ojeda con Bordaveri en La Valleja es con la Lista 10. Con Robert y con todo el equipo de Vamos La Valleja y Vamos Uruguay.",,1,0,0,0,0,0,
543661148459536,"['No cumplieron, nos clavaron el visto', 'No cumplieron, nos clavaron el visto'] le cuidamos la plata a los uruguayos",,0,1,0,1,0,0,
546744097758692,"""Uruguay es caro. Tenemos que adaptarnos al mundo de hoy y trabajar para lograr un Estado más eficiente, que dinamice la economía y haga de Uruguay un país más accesible para todos.\n\nConocé más en nuestro sitio web."" Uruguay es caro. Es caro para la gente de vivir y es caro para los negocios de producir o tener su actividad comercial. Además de caro se está volviendo relativamente ineficiente en sus procesos. Es lento, hacer un trámite toma mucho tiempo, es demasiado formalista. En vez de adoptar la tecnología para hacer las cosas rápido, hay una resistencia del estado a cambiar y eso genera ineficiencias, lentitud que afecta hasta el ánimo de muchísimos uruguayos. Muchos empresarios ya no aguanta más la lentitud del sistema, no aguanta más cómo funciona el sistema impositivo y la carga que le genera. Muchos individuos que trabajan solos terminan en la informalidad porque ya es imposible cumplir con todos los requisitos, con todas las obligaciones que se les imponen. Y eso es una montaña y embarañamiento de regulaciones, de leyes, de ideas que yo creo que hoy enlentecen al Uruguay sin hacerlo más fuerte institucionalmente. Ese gran movimiento creo que hay que entenderlo y hay que empezar a reorganizarlo de otra manera. Va a permitir que la gente emprenda y viva con mucha más libertad y de una manera mucho más eficiente.",,0,1,0,1,0,0,
546923954471756,"[""🌟 ¡Vota Lista 2812! 🌟\n\nEste 27 de octubre, únete a nosotros para construir un futuro mejor. Apoya a María de Lima como Diputada y juntos trabajaremos por un Departamento más justo y próspero.\n\n✅ Compromiso ✅ Transparencia ✅ Progreso\n\n¡Tu voto es fundamental! Marca la diferencia con la Lista 2812. ¡Vamos para adelante!\n\n#Elecciones2024 #Lista2812 #MariaDeLima #Uruguay"",""🌟 ¡Vota Lista 2812! 🌟\n\nEste 27 de octubre, únete a nosotros para construir un futuro mejor. Apoya a María de Lima como Diputada y juntos trabajaremos por un Departamento más justo y próspero.\n\n✅ Compromiso ✅ Transparencia ✅ Progreso\n\n¡Tu voto es fundamental! Marca la diferencia con la Lista 2812. ¡Vamos para adelante!\n\n#Elecciones2024 #Lista2812 #MariaDeLima #Uruguay"",""🌟 ¡Vota Lista 2812! 🌟\n\nEste 27 de octubre, únete a nosotros para construir un futuro mejor. Apoya a María de Lima como Diputada y juntos trabajaremos por un Departamento más justo y próspero.\n\n✅ Compromiso ✅ Transparencia ✅ Progreso\n\n¡Tu voto es fundamental! Marca la diferencia con la Lista 2812. ¡Vamos para adelante!\n\n#Elecciones2024 #Lista2812 #MariaDeLima #Uruguay""] De relación Colonia entendemos la importancia de la descentralización. También entendemos que para esto, precisamos un departamento pujante con muchas oportunidades para que los más jóvenes y las nuevas generaciones no se vayan a otros lugares como puede ser Montevideo y se queden aquí en el departamento de Colonia. Por eso y por muchas cosas más votamos la 28-12.",,1,0,1,1,1,0,
547311291309967,"""Escuchar es clave para construir juntos el futuro que queremos. En estos testimonios, vecinas y vecinos de Soriano comparten su apoyo a la lista 901001.\n¡La esperanza para avanzar!\n#yamandúorsipresidente\n#oscarandradesenador\n#enzomalandiputado\n#lista901001\n#frenteamplio\n #votosí"" Es la lista que mejor interpreta mis ideas. Para terminar con las desigualdades y para renovar la esperanza. Apoya la reforma de la seguridad social. Con Oscar Andrés del Senado y Enzo Malana, la Ley de Puntación. Es una persona honesta, trabajadora, comprometida con una sociedad más justa. Voto la 90-1001. Y a la reforma juridatórica.",,1,0,1,1,1,0,
548474711113275,"""Sumate a la campaña. Dejanos tus datos."" Hay determinados gastos del Estado que son realmente un exceso. El Estado somos todos nosotros que estamos pagando. Eso porque yo siempre digo, qué generosos cuando dicen vamos a construir tal cosa, le vamos a dar tantos millones aquí y allá. Pero va a salir de la espalda, billetera, dice. Va a salir de la espalda de todo el pueblo, de la gente que está trabajando y convertido en determinado impuesto. Porque además, otra cosa, Uruguay realmente es un país que tiene demasiados impuestos. Se da el lujo de tener uno de los sitios más altos del mundo. Entonces, sin duda, eso es una de las cosas que hay que resolver y hay que bajar. Incluso nosotros lo planteamos también para el tema de la canasta básica que urugía bajar por esa parte el IU. Por eso nosotros insistimos tanto en nuestro primer hallazgo. En esos 2.200 millones de dólares que salen de la reducción de personal que no afecta el funcionamiento del Estado. Y la otra es la que siempre hacemos la misma broma, la de los cafés y alguna cosa más. Donde también, ¿saben lo que es que ya no se gasta en 1.730 millones de dólares? Que a tu altura no es ser más porque bueno, fue cuando empezamos la campaña de la TRE candidatura que hicimos todos esos cálculos. Entonces, hasta en esos gastos superfluos, uno puede recortarlo.",,0,1,0,1,1,0,
549333357538842,"🟢 𝐇𝐀𝐂𝐄𝐑 𝐏𝐎𝐒𝐈𝐁𝐋𝐄 𝐋𝐎 𝐈𝐌𝐏𝐎𝐒𝐈𝐁𝐋𝐄 🟢 Tenemos la obligación de hacer posible lo que que aparenta ser imposible. Para dejar todo como está no vinimos a la militancia Por un futuro justo, la 90 YAMANDÚ, CAROLINA y VOS 🔴🔵⚪️",,1,0,0,0,1,0,
549547781000263,"""Mateo Ayala: \nSoluciones reales para mejorar la salud en Artigas\n🏥 \""La clave para reducir el tiempo de espera en emergencia es fortalecer la red periférica de atención.\""\n\nMateo Ayala expone su plan para mejorar la atención médica en Artigas, centralizando el cuidado en los barrios y creando una red de médicos de referencia que conozcan a los pacientes. \nAsí, evitaremos la saturación de las emergencias y mejoraremos la calidad de vida.\n\n👉 Conocé más sobre esta propuesta en la entrevista completa en nuestro canal de YouTube.\n👉👉 https://youtu.be/FVzBohEOyX0 👈👈\n\n ✅Vota lista 40, ✅\n la lista del Cambio y la Renovación para Artigas. \n💪 Vota Álvaro Delgado PRESIDENTE\n.\n.\n.\n.\n.\n.\n.\n#Lista40Artigas #MateoAyala #SaludParaTodos #RedDeSaludYA #DelgadoPresidente #MejorAtencion #SolucionesReales"" La forma de disminuir el tiempo de consulta en emergencia es mejorando la red periférica de atención. Si nosotros mejoramos las policlínicas barriales con toda la atención periférica, con todo lo que amerita tener una verdadera red de atención periférica, seguramente no va a haber tanta demanda en la emergencia en los hospitales de Artías. Eso se puede hacer, ya está establecido, por ahí lo tiene, teniendo un médico referente, que son los médicos de posto de saúde. Nosotros deberíamos también abrir cargos para médicos que estén centralizados en su barrio y que conozcan su policlínica y a seguirse en oje. Sea su pueblo, su región, una población de cinco con dos médicos y bueno, reconozcan la realidad de cada sector, de cada barrio. Entonces la gente, las personas que van a consultar, van a empezar a consultar en la periferia y no tanto en la emergencia, porque van a tener su punto de referencia, su médico, su amigo, su conocido, el que sabe de sus problemas y no simplemente ir al hospital.",,1,0,0,1,1,0,
550387067472886,{} Somos Inean...,,0,0,0,0,0,0,SACAR
551184940873234,"['En acto de la Coalición en Punta del Este, Andrés Carrasco, representante departamental del PI, invitó a comparar la gestión de Álvaro Delgado durante este período, con la de Orsi y Cosse en las intendencias de Montevideo y Canelones.'] Yo le voy a contar una anécdota que me pasó hace unos días con un amigo un amigo que hacía muchos años votaba al Frente Amplio y hace tres elecciones que me dijo, vos estás en el Partido Independiente, te voy a seguir, te voy a acompañar, voy a poner tu voto siempre a vos, y hacía bien mío siendo. Y hace unos días me decía, che, pero ahora, no sé la verdad qué hacer, ¿Yo quiero votar al Partido Nacional? Digo, no, no es solo el Partido Nacional. Vos tenés que votar al Partido Independiente, a Cabildo Abierto, al Partido Contesucional Mentalista, al Partido Colorado y también al Partido Nacional. Pero una coalición que se formó hace cinco años y hoy está madura y que hoy ha llegado para quedarse. Entonces vos tenés que votar por eso, pero no solamente por eso por decir es también votar lo que votaste en octubre, sino porque han sido cinco años de logros muy arriba. Vamos a comparar las fórmulas y te voy a decir, vos vas a votar a alguien que ha hecho una gestión muy buena a nivel de gobierno, a nivel parlamentario. ¿Vos que venís a Maldonado y muchas veces estás acá? ¿Cómo estás a Maldonado? No, Maldonado es hermoso, me dice. Maldonado da gusto de venir. Cuando vas a Canelones, que ya salís un poco de... Y bueno, allá se ven los pastos un poco más altos, se ven más pozos en la calle. Bueno, ese va a ser el que se tira presidente o el que quiere ser presidente por el otro lado. Y llega a Montevideo, Montevideo es un desastre. Mugres por todos lados, es una sociedad sucia, descuidada, sin inversión. Bueno, esa es la que se tira a candidata vicepresidenta por el otro lado. Entonces no hay duda. No hay duda cuál es lo que hay que elegir el próximo 24 y que tiene que ser Álvaro Delgado y que tiene que ser la coalición republicana.",,1,1,1,1,0,0,
553987713857954,"[""🎙 Mario Ayala referente y candidato de la lista 40, responde a las preguntas más difíciles en una entrevista reveladora que no esquiva los temas más delicados.\n\n🔥 Escándalo Caram-Do Santos, la problemática de Artigas y las soluciones reales que el equipo de la lista 40 propone. \n\nTodo esto y más en una conversación que no deja espacio para la duda.\n\n💬 Mario Ayala no se guardó nada: desde los desafíos que enfrenta nuestro departamento hasta los proyectos concretos que la lista 40 lidera para devolverle a Artigas su lugar.\n\n🌟 Este 27 de octubre, vota por la solución y el cambio.\n ✅Vota lista 40 ✅\nvota Álvaro Delgado Presidente.\n\n👉 Haz clic para ver la entrevista completa en YouTube \ny conoce cómo podemos llevar a Artiga al Futuro\n👉 https://www.youtube.com/watch?v=UutUZJUICtk"",""🎙 Mario Ayala referente y candidato de la lista 40, responde a las preguntas más difíciles en una entrevista reveladora que no esquiva los temas más delicados.\n\n🔥 Escándalo Caram-Do Santos, la problemática de Artigas y las soluciones reales que el equipo de la lista 40 propone. \n\nTodo esto y más en una conversación que no deja espacio para la duda.\n\n💬 Mario Ayala no se guardó nada: desde los desafíos que enfrenta nuestro departamento hasta los proyectos concretos que la lista 40 lidera para devolverle a Artigas su lugar.\n\n🌟 Este 27 de octubre, vota por la solución y el cambio.\n ✅Vota lista 40 ✅\nvota Álvaro Delgado Presidente.\n\n👉 Haz clic para ver la entrevista completa en YouTube \ny conoce cómo podemos llevar a Artiga al Futuro\n👉 https://www.youtube.com/watch?v=UutUZJUICtk"",""🎙 Mario Ayala referente y candidato de la lista 40, responde a las preguntas más difíciles en una entrevista reveladora que no esquiva los temas más delicados.\n\n🔥 Escándalo Caram-Do Santos, la problemática de Artigas y las soluciones reales que el equipo de la lista 40 propone. \n\nTodo esto y más en una conversación que no deja espacio para la duda.\n\n💬 Mario Ayala no se guardó nada: desde los desafíos que enfrenta nuestro departamento hasta los proyectos concretos que la lista 40 lidera para devolverle a Artigas su lugar.\n\n🌟 Este 27 de octubre, vota por la solución y el cambio.\n ✅Vota lista 40 ✅\nvota Álvaro Delgado Presidente.\n\n👉 Haz clic para ver la entrevista completa en YouTube \ny conoce cómo podemos llevar a Artiga al Futuro\n👉 https://www.youtube.com/watch?v=UutUZJUICtk""] Tenemos un elenco nuevo y tenemos una propuesta basada en qué? Basada en el desarrollo departamental. En primer lugar, el tener claro que hay otra manera de hacer las cosas. En segundo lugar, estamos basado en planteando un desarrollo departamental que tenga como eje el tema de la educación para los niños, la formación para los jóvenes con la instalación de un UTEK en el departamento de Artigas para formar a jóvenes para la demanda laboral de este mundo que nos toca vivir hoy.",,1,0,0,1,1,0,
554290927325568,En Canelones vota 77363,,0,0,0,0,1,0,
554438510660088,"['GOBIERNO DE CERTEZAS!\n\nEL 24 ELEGÍ COALICION'] Mi nombre es Ezequiel Ibarra, fui candidato a diputado del Partido Colorado en el departamento de Florida. Hoy quiero empezar esto con una frase, Uruguay es un país pequeño, pero hay una frase que dice que pequeño es el faro de quienes hoy anhelan la libertad. Somos un ejemplo de país en todo Latinoamérica y en todo el mundo, y queremos continuar siempre en ese camino de libertad y respeto, pero siempre con certezas. Certeza de viviendas. Certeza nada más y nada menos que en la educación. Certeza del progreso. El gobierno no promete que a futuro sabrá cumplir, está cumpliendo. Por eso, este 24 de noviembre, el hijo coalición.",,1,0,0,0,0,0,
554929090353717,"""Los reyes del engaño nos quieren hacer creer que las AFAP son buenas, pero los números hablan.\nLa compañera de la #JuventudPVP Romina Oviedo no los explica. \nVotala con la #Lista5567enMontevideo. \nVotá gente común como vos. \n\n#LaIzquierdaVivaConLa5567 \n#AfirmáTusDerechos"" De poco más de 60 mil rentas vitalicias de las AFAP, el 80% gana menos de 11.300 pesos. El promedio de las jubilaciones por BPS es de 28 mil pesos. Por favor, con estos números los reyes del engaño nos quieren hacer creer que votar sí al plebiscito de la seguridad social va a fundir al país? Muchas y muchos frente a amplistas decimos sí a la reforma de la seguridad social. En Montevideo, con la lista 5567PBP Frente Ampli.",,1,1,0,1,1,0,
555693083812216,"""#andresojeda #andresojedapresidente #blancosconojeda #partidoblanco #partidonacional #ojedapresidente #uruguay #elecciones2024"" Pensad que yo era blanco, como hueso a caballo, pero después me volteé a patear un cuchillo.",,1,0,0,0,1,0,
555827680191010,"[""Una gestión que cumplió sus promesas con responsabilidad es sinónimo de garantías y confianza. En octubre, asegurá el peso de un equipo comprometido con el país. Porque todavía queda mucho por hacer. \n\nPablo Mieres al Senado \nLa mejor opción de la coalición\nPodés confiar"",""Una gestión que cumplió sus promesas con responsabilidad es sinónimo de garantías y confianza. En octubre, asegurá el peso de un equipo comprometido con el país. Porque todavía queda mucho por hacer. \n\nPablo Mieres al Senado \nLa mejor opción de la coalición\nPodés confiar""] Yo me acuerdo. Pablo, yo me acuerdo. Yo me acuerdo. En octubre yo te di mi voto a confianza. No te olvides. No me olvido. Podés confiar. Pablo Mieres al Senado. La mejor opción de la coalición. Podés confiar.",,1,0,1,0,1,0,
555870733523150,"""Hola! Soy Javier Barrios, Edil del Partido Nacional. Mi sueño es construir un Montevideo diferente y estoy convencido de que los grandes cambio comienzan por las cosas cotidianas de todos los días. \n\n📢❗️Este domingo 27/10 te invito a reelegir un buen gobierno y con la lista 250 un buen senado. DELGADO PRESIDENTE | GANDINI SENADOR 🇺🇾🇺🇾\n\n#Uruguay #lista250 #pormibarrio #partidonacionaluy"" Hola soy Javier Barriobove, emilio del partido nacional. Quizás me reconozcas por haber confrontado y denunciado las pésimas gestiones del Frente Amplio Montevideo. Tengo 47 años, soy abogado, esposo y orgulloso padre de Águas y Nacho. Hace más de 20 años he vivido en Positos. Mi sueño es tener un Montevideo diferente. Los grandes cambios empiezan por las cosas cotidianas de todos los días. Mejorando nuestro barrio vamos a tener una situación más disfrutable. Juntos podemos lograr un lugar en donde estemos orgullosos de vivir. Te invito a subirte a este camino. El próximo domingo 27 nos jugamos mucho. Te invito a reirigir un buen gobierno y con la 250 un buen senado. Delgado presidente, Candini Senado.",,1,0,1,0,1,0,
556484460147001,"[""Sabemos que reducir la pobreza infantil a la mitad en 5 años es posible. En octubre, asegurá el peso de un equipo especialista en políticas sociales. \n\nPablo Mieres al Senado\nLa mejor opción de la coalición\nPodés confiar"",""Sabemos que reducir la pobreza infantil a la mitad en 5 años es posible. En octubre, asegurá el peso de un equipo especialista en políticas sociales. \n\nPablo Mieres al Senado\nLa mejor opción de la coalición\nPodés confiar""] Hay un candidato que todavía insiste en resolver los temas más urgentes del país. El 50% de los menores de 5 años nacen en hogares pobres. ¿Es posible reducir la pobreza infantil a la mitad? Pablo Mieres al Senado. La mejor opción de la coalición. Podés confiar.",,1,0,0,1,1,0,
556573610359296,"""A una semana de las elecciones, contamos con tu voto. Votá 318, Yamandú Presidente, Andrés Lima Senador y Gerardo Viñales Diputado"" Tus sueños son nuestros objetivos. Este 27 de octubre votá 318. Llamando al presidente Andrés Senador, el árbol diputado.",,1,0,0,0,1,0,
556840170165665,"""Proponemos la emisión de un Bono Infancia, un instrumento novedoso y genuino para financiar la reducción de la pobreza infantil, en acuerdo con el Presidente de la Bolsa de Valores de Montevideo, Angel Urraburu"" Y yo quiero decir que desde el Partido Independiente vamos a empujar para que se emita un bono infancia, un bono de los de deuda, pero que tenga un sentido directo, con una finalidad concreta, para que la plata que los ahorristas uruguayos pongan en ese bono tenga como resultado un impacto directo e inmediato sobre una mejora de las condiciones de vida de los hogares más pobres, con niños pobres. Y yo creo que va a haber muchos ahorristas que van a elegir invertir en un bono con objetivo directo y además del que hay que rendir cuenta periódicamente para demostrar que esa plata efectivamente va al objetivo que se plantea. Y entonces evitarnos la discusión del tironeo presupuestal",,1,0,0,1,0,0,
